sha,is_merge,parents_count,modified_files_count,code_churn,max_file_churn,avg_file_churn,deletions,insertions,net_lines,dmm_unit_size,dmm_unit_complexity,dmm_unit_interfacing,total_token_count,total_nloc,total_complexity,total_changed_method_count,commit_message
ae79d4e5f00fcd639ba11715f02963828217cf40,False,1,1,6,6,6.0,3,3,0,,,,371,66,15,0,Do not log redis sentinel username and password
bfcef58a4f701166146aa37a1132707486c3b69f,False,1,1,5,5,5.0,2,8,6,0.0,0.0,1.0,2181,337,73,1,Fix KV reference rendering
cd16321dd9c25bb47a2e9417b2a4a75959be63d0,False,1,1,30,30,30.0,362,284,-78,0.6666666666666666,0.6666666666666666,0.0,4390,673,136,2,"Bump to go1.24

Co-authored-by: Romain <rtribotte@users.noreply.github.com>"
859f4e886860442207d7ebc3b047d0bad44ba461,False,1,4,184,95,46.0,209,338,129,0.0,1.0,1.0,8175,1258,290,12,"Use routing path in v3 matchers

Co-authored-by: Romain <rtribotte@users.noreply.github.com>"
ab3234e458c306a8a1c68f885b578a805e039daf,False,1,1,7,7,7.0,1,6,5,0.0,0.0,1.0,953,145,27,1,Scope the rate limit counter key by source AND by middleware
08d5dfee0164aa54dd44a467870042e18e8d3f00,False,1,2,188,186,94.0,17,504,487,0.14912280701754385,0.7953216374269005,0.9941520467836257,6057,944,205,5,"Normalize request path

Co-authored-by: Romain <rtribotte@users.noreply.github.com>"
b669981018476eb75666d201254a3a0bb868913f,False,1,1,20,20,20.0,9,68,59,0.0,0.9230769230769231,1.0,4053,582,151,2,"Fix panic for ingress with backend resource

Co-authored-by: Kevin Pollet <pollet.kevin@gmail.com>"
76153acac6cb91848a0c00e7f9e0bd4c7287fe82,False,1,1,2,2,2.0,7,7,0,,,,136,39,0,0,"Fix CEL validation for RootCA in ServersTransport

Co-authored-by: Kevin Pollet <pollet.kevin@gmail.com>"
3deea566ac303f3020225b016b2179d709a8e011,False,1,1,8,8,8.0,2,6,4,0.0,0.0,1.0,1080,162,34,1,Make P2C strategy thread-safe
79fde2b6dd681511a07823ccc41f5273870832fe,False,1,1,4,4,4.0,1,3,2,0.0,0.0,1.0,2371,332,90,1,Do not warn network missing if connected to a container network
3ee316c5bbe84a63ba573d4303fb8bad71c5a368,False,1,1,2,2,2.0,11,24,13,,,,278,85,0,0,Fix incorrect case and missing rbac in documentation
7403b6fb82582e96cdd0a2e57451bfcd10eabb8c,False,1,4,31,10,7.75,11,403,392,0.03468208092485549,0.976878612716763,0.9884393063583815,7792,1161,279,4,Fix concatenation of IPv6 addresses and ports
87b57406ffa87021e2d3253ecbe8ec8a5779554c,False,1,1,6,6,6.0,23,89,66,0.25925925925925924,0.9629629629629629,0.7962962962962963,2232,338,76,1,Add SpanID and TraceID accessLogs fields only when tracing is enabled
77a0cef9ce17f994142e4fee062a05f0d5aa780a,False,1,1,1,1,1.0,0,1,1,0.0,0.0,1.0,4118,620,136,1,"fix k8s crd to read contentType middleware into dynamic config

Co-authored-by: John Pekcan <apekcan@ea.com>"
dd5cb68cb1aeda490adefdbb5bb8887aef9cc699,False,1,2,36,26,18.0,17,278,261,0.23893805309734514,0.9734513274336283,0.9734513274336283,4163,681,136,5,Sanitize request path
2d617b3a655fcd7729423d813a4a22750f20e67e,False,1,1,2,2,2.0,17,1,-16,,,,278,85,0,0,Remove default load-balancing strategy from CRD
545f2feacc37acd5985247a9965064639ae82e5f,False,1,1,1,1,1.0,0,6,6,0.16666666666666666,1.0,1.0,874,143,39,1,Add Content-Length header to preflight response
f794f8a29491b8467868811a3142a48e8f0a3854,False,1,5,30,8,6.0,319,342,23,1.0,1.0,0.0,10942,1745,376,6,chore: update linter
bb8dfa568a8b7f738366bdbf0a3b08382a9edd2d,False,1,1,2,2,2.0,4,4,0,,,,472,125,0,0,Restrict regex validation of HTTP status codes for Ingress CRD resources
ddb32ef86fbbfe85dfe1a4fb4b5bedf3261b5b97,False,1,1,2,2,2.0,1,6,5,0.0,1.0,1.0,1928,338,85,0,Allow underscore character in hostSNI matcher
496f00c7c2c315b070b45d171ad4095656565f92,False,1,3,116,80,38.666666666666664,81,178,97,0.3548387096774194,1.0,1.0,3062,597,112,10,"Revert compress middleware algorithms priority to v2 behavior

Co-authored-by: Kevin Pollet <pollet.kevin@gmail.com>"
42778d2ba65520c4b7a4fe12e7acceac1c9a8415,False,1,1,6,6,6.0,1,15,14,0.0,0.8333333333333334,1.0,1795,309,66,1,Do not abort request when response content-type is malformed
84742275a4a00ef517944dd3265ab6140649a355,False,1,2,22,21,11.0,40,18,-22,0.0,0.0,0.0,3183,494,115,1,Bump golang.org/x/net to v0.37.0
8ba99adc503b637b0e424605e2397ee132ddda34,False,1,1,28,28,28.0,2,72,70,0.24074074074074073,0.9074074074074074,0.9074074074074074,717,122,23,3,"Error level log for configuration-related TLS errors with backends

Co-authored-by: Kevin Pollet <pollet.kevin@gmail.com>"
05c547f211ed7ef831bdff6926d86f64aaf1915a,False,1,3,110,94,36.666666666666664,35,175,140,0.211864406779661,0.9915254237288136,0.9576271186440678,4162,607,127,8,Fix double hash in sticky cookie
14e400bcd000a85c63184a49250c27bfdf093037,False,1,2,359,345,179.5,385,350,-35,0.42,0.48,0.0,4434,688,148,22,Bump AWS SDK to v2
3c99135bf9d808fdb4ab75d227b28377db6e95d3,False,1,1,190,190,190.0,98,100,2,0.0,0.0,0.0,5175,710,148,4,"Set scheme to https with BackendTLSPolicy

Co-authored-by: Kevin Pollet <pollet.kevin@gmail.com>"
474ab23fe920243d2b7def642c4be53656178074,False,1,1,24,24,24.0,69,175,106,0.189873417721519,0.9493670886075949,1.0,1782,307,66,2,"Compress data on flush when compression is not started

Co-authored-by: Romain <rtribotte@users.noreply.github.com>"
cce935493ac19d9b02fc86a79ac5269720fc58b5,False,1,1,2,2,2.0,1,24,23,1.0,1.0,1.0,1775,262,67,1,Fix panic when calling Tracer
f196de90e1bc029db23ed9b012ceb5007750348e,False,1,2,102,89,51.0,65,100,35,0.8695652173913043,1.0,0.9565217391304348,3772,577,122,16,"Enable the retry middleware in the proxy

Co-authored-by: Romain <rtribotte@users.noreply.github.com>"
c2a294c872aeae8415bcbb748a4d09de719a70b4,False,1,1,3,3,3.0,18,40,22,1.0,1.0,1.0,1074,185,38,1,"Retry should send headers on Write

Co-authored-by: Romain <rtribotte@users.noreply.github.com>"
1ccbf743cbde602e4bc676f7bf4e07cade9198b0,False,1,2,46,38,23.0,63,135,72,0.0,0.0,1.0,2736,441,102,5,"Add WebSocket headers if they are present in the request

Co-authored-by: Romain <rtribotte@users.noreply.github.com>"
1cfcf0d3187946f29bc54b9b4e493d7736c3d2a9,False,1,1,37,37,37.0,18,60,42,0.3448275862068966,1.0,1.0,2023,361,84,1,"Chunked responses does not have a Content-Length header

Co-authored-by: Romain <rtribotte@users.noreply.github.com>"
56ea028e811c7eb3de0fdf9a27920a825f3d26bc,False,1,1,6,6,6.0,6,13,7,,,,2476,393,59,1,"Change request duration metric unit from millisecond to second

Co-authored-by: Kevin Pollet <pollet.kevin@gmail.com>"
b74767bfa4535b80f092a3d461030b4dab236630,False,1,2,8,4,4.0,6,19,13,0.3333333333333333,1.0,1.0,2608,390,86,3,Use ResourceAttributes instead of GlobalAttributes
d04e2d717ccbcd42a225823a7246b4b04f20888e,False,1,3,6,3,2.0,1,22,21,0.0,0.5,0.5,9466,1520,312,1,Add missing headerField in Middleware CRD
cdd24e91b4844ebe60e86a511ceba8046d9d5487,False,1,1,3,3,3.0,4,1,-3,1.0,0.5,0.0,2041,361,85,1,"Fix content-length header assertion

Co-authored-by: Romain <rtribotte@users.noreply.github.com>"
86315e0f184b8bd0b6a0f200da182e76b3ee80c9,False,1,2,44,38,22.0,17,33,16,0.0,0.0,1.0,4020,633,149,9,Fix ACME write when traefik is shutting down
857fbb933ee5060a05e3b57353b64a7a3f93d542,False,1,5,86,46,17.2,62,133,71,0.16666666666666666,0.5555555555555556,1.0,6450,967,234,10,"Do not create observability model by default

Co-authored-by: Kevin Pollet <pollet.kevin@gmail.com>"
435d28c790fe9eea2501f60fa6d7db8b99df9166,False,1,1,4,4,4.0,2,2,0,,,,1727,287,64,1,changing log message when client cert is not available to debug
c5b92b52603ff262851d273fd6451cea589df073,False,1,1,8,8,8.0,1,7,6,,,,635,108,20,1,Do not create a logger instance for each proxy
fb527dac1c4109fdace879d575e7580553fe8491,False,1,1,18,18,18.0,1,57,56,0.7073170731707317,0.7073170731707317,1.0,2045,362,85,1,"Handle responses without content length header

Co-authored-by: Kevin Pollet <pollet.kevin@gmail.com>"
f1c4ba2f268f1dcae91c944e9e324eea0ec3e6b2,False,1,1,2,2,2.0,3,1,-2,,,,80,17,3,0,Remove duplicate github.com/coreos/go-systemd dependency
4ce4bd71216e2b287c13bbfcf198056be486bb5d,False,1,2,14,7,7.0,32,18,-14,1.0,0.0,0.0,2595,387,79,2,"Bring back TraceID and SpanID fields in access logs

Co-authored-by: Kevin Pollet <pollet.kevin@gmail.com>"
ad7fb8e82b01646054e0981ea563d27311b2fe74,False,1,1,15,15,15.0,8,217,209,,,,2440,345,64,1,Fix observability configuration on EntryPoints
0528c054a6fa2b6565619b57f2df0f3589c05c12,False,1,2,24,19,12.0,6,46,40,0.8518518518518519,0.8518518518518519,0.9629629629629629,3703,638,145,3,"Do not read response body for HEAD requests

Co-authored-by: Romain <rtribotte@users.noreply.github.com>"
0a6ff446c7d455345e06c2f7af78a0b76180968b,False,1,2,4,2,2.0,4,4,0,,,,7703,1139,278,1,Fix deprecated dnsChallenge propagation logging and documentation
9a9644bafeeae7fe5bde2a014ab50c43843110ef,False,1,1,21,21,21.0,10,11,1,0.0,1.0,1.0,586,80,12,3,Set content-type when serving webui index
f9ff6049d3b79b50e77ecbfb6700266e1cd656ca,False,1,2,22,21,11.0,0,22,22,1.0,1.0,1.0,3230,510,118,1,"Disable http2 connect setting for websocket by default

Co-authored-by: Kevin Pollet <pollet.kevin@gmail.com>
Co-authored-by: Julien Salleyron <julien.salleyron@gmail.com>
Co-authored-by: Michael <michael.matur@gmail.com>"
7cb46626a1f2e833a64376ee599f0757947fe1e0,False,1,2,22,21,11.0,0,22,22,1.0,1.0,1.0,3437,511,113,1,"Disable http2 connect setting for websocket by default

Co-authored-by: Kevin Pollet <pollet.kevin@gmail.com>
Co-authored-by: Julien Salleyron <julien.salleyron@gmail.com>
Co-authored-by: Michael <michael.matur@gmail.com>"
189db8d990d43d5774cd1b5f708d938bc1b5ed4f,False,1,1,5,5,5.0,39,104,65,0.0,0.9361702127659575,0.9361702127659575,2169,305,81,1,Pass TLS bool from IngressRouteTCP to TCPService
139f929ec8b9dfdc96aff642c162a63b7b829ff7,False,1,2,4,2,2.0,4,17,13,0.0,1.0,1.0,10715,1399,340,2,Support empty value for core Kubernetes API group
95f20fc753aa3c6f2b408f5691fe0786ae77108b,False,1,1,3,3,3.0,0,3,3,0.0,1.0,0.0,631,107,20,1,Configure ErrorLog in httputil.ReverseProxy
109a8712cc87079886308ab38815f5560083d5fb,False,1,102,204,2,2.0,105,106,1,,,,78100,11118,2035,0,Update copyright for 2025
a29628fa2e45b355ef9439fc27af6be2c940e537,False,1,2,4,2,2.0,9,113,104,0.0,1.0,1.0,8510,1183,308,2,"Fix fenced server status computation

Co-authored-by: Romain <rtribotte@users.noreply.github.com>"
514914639aeb2d493062126950192bb9bff82799,False,1,4,149,68,37.25,89,148,59,0.2894736842105263,0.2631578947368421,0.8947368421052632,5622,836,188,16,Rename traefik.docker.* labels for Docker Swarm to traefik.swarm.*
42df9afeaf5582f68178aa349674428a059ebce3,False,1,1,12,12,12.0,122,210,88,0.0,0.0,1.0,208,40,6,1,Fix release by using github action
c8b0285c912f3822d218f701792c55003910b8e1,False,1,2,60,52,30.0,4,183,179,0.5904761904761905,1.0,1.0,1254,173,32,3,Fix WASM settings
2b35c7e20587f2e3905ed97be48875478abcfa00,False,1,2,23,16,11.5,11,12,1,0.0,0.0,1.0,3741,524,109,2,"Fix models mechanism for default rule syntax

Co-authored-by: Kevin Pollet <pollet.kevin@gmail.com>"
5bf4b536e220ab68108d0c65c873f7bc222507b9,False,1,1,2,2,2.0,1,1,0,,,,433,66,14,1,Change logs output from stderr to stdout
a50345bf8de568218db8cad5b9b38b36b23b002c,False,1,8,203,56,25.375,153,349,196,0.16393442622950818,0.8032786885245902,0.8360655737704918,26944,3834,940,15,"Allow to disable Kubernetes cluster scope resources discovery

Co-authored-by: Kevin Pollet <pollet.kevin@gmail.com>"
7056eeff6af3dcca770de040da80e3f9c084a6d1,False,1,1,2,2,2.0,1,1,0,,,,2264,447,106,0,Re-allow empty configuration for Kubernetes Ingress provider
31a93d50459ec684f0357e1569af37adbe29b7a6,False,1,1,4,4,4.0,2,2,0,,,,1112,152,36,1,Fix log when default TLSStore and TLSOptions are defined multiple times
584144100524277829f26219baaab29a53b8134f,False,1,6,88,75,14.666666666666666,31,475,444,0.08132530120481928,0.9066265060240963,0.9939759036144579,7294,1188,252,7,"Cleanup Connection headers before passing the middleware chain

Co-authored-by: Romain <rtribotte@users.noreply.github.com>"
58bbc0cf0f599b49702f4bb587c5f2d899dbe2d0,False,1,1,2,2,2.0,10,4,-6,,,,159,49,0,0,Remove mentions about APIVersion traefik.io/v1
8d0979bfd0e909288add7db466d0f5c0dd25cea9,False,1,1,1,1,1.0,0,2,2,0.0,0.5,1.0,1761,251,65,1,"Enable TLS for Consul Connect TCP services

Co-authored-by: Kevin Pollet <pollet.kevin@gmail.com>"
0dc36379cf6cfe613ec820e58dfde8a28b231210,False,1,4,14,6,3.5,517,517,0,,,,11980,1628,316,6,"Ensuring Gateway API reflected Traefik resource name unicity

Co-authored-by: Kevin Pollet <pollet.kevin@gmail.com>"
70968bc6a963da72aa6d0f15cbe33bc5a338097d,False,1,1,17,17,17.0,9,8,-1,1.0,1.0,0.0,1777,290,64,1,"Remove deadlines for non-TLS connections

Co-authored-by: Kevin Pollet <pollet.kevin@gmail.com>"
5e4dc783c7bb42832286dcdc645590a6fe4835a6,False,1,2,8,4,4.0,4,28,24,,,,1454,254,29,0,Allow empty configuration for OpenTelemetry metrics and tracing
5fd6913ee587a779334e2e2d626b0ef2806a5ebf,False,1,1,12,12,12.0,3,24,21,0.0,0.5,1.0,2199,347,49,1,"Fix OpenTelemetry metrics

Co-authored-by: LandryBe <[lbenguigui@gmail.com](mailto:lbenguigui@gmail.com)>"
4720caed0437865a1fdf1a7dd54f1f228ab00ac7,False,1,1,19,19,19.0,6,13,7,1.0,1.0,1.0,3824,587,125,1,Update open connections gauge with connections count
fdce8c604a4cf26e25c3ff5da331002c1c6503b9,False,1,2,4,2,2.0,2,2,0,,,,2594,420,94,2,Change level of peeking first byte error log to DEBUG for Postgres
a79cdd1dfae08596fdaadf48d3b1c0f3b225284a,False,1,1,8,8,8.0,4,4,0,,,,1813,294,66,2,"Change level of peeking first byte error log to DEBUG

Co-authored-by: Kevin Pollet <pollet.kevin@gmail.com>"
d51a2ce48741acaf9e19229ab89d0ebc09a5a843,False,1,1,5,5,5.0,3,17,14,0.0,1.0,1.0,1769,287,62,1,Compute priority for https forwarder TLS routes
a84d5c0ef1379b9e863d0c32927a614d3478761e,False,1,1,1,1,1.0,13,12,-1,1.0,0.0,0.0,6488,954,226,1,"Adjust deprecation notice for Kubernetes CRD provider

Co-authored-by: Baptiste Mayelle <baptiste.mayelle@traefik.io>"
6155c900be5539d8d5ebe9ba7a4be5f88e9f067f,False,1,1,2,2,2.0,4,6,2,0.0,0.0,1.0,1382,246,59,1,"Passing the correct status code when compression is disabled within the Brotli handler

Co-authored-by: Kevin Pollet <pollet.kevin@gmail.com>"
70dd7cdc7195ef98b42934693e9a4973852f368c,False,1,2,62,61,31.0,28,154,126,0.00819672131147541,0.9918032786885246,1.0,6620,988,228,2,"Enforce default cipher suites list

Co-authored-by: Kevin Pollet <pollet.kevin@gmail.com>"
240b83b77351dfd8cadb91c305b84e9d22e0f9c6,False,1,1,2,2,2.0,9,6,-3,,,,1419,253,58,0,"Set default ReadTimeout value to 60s

Co-authored-by: Kevin Pollet <pollet.kevin@gmail.com>"
85039e0d54ddd551f4f695b11cfd7ae138743990,False,1,1,1,1,1.0,2,5,3,0.6666666666666666,0.6666666666666666,1.0,1361,243,59,1,Fix brotli response status code when compression is disabled
7f29595c0a5d8f824757b624f0774d12c4f9743e,False,1,1,2,2,2.0,1,23,22,0.0,1.0,1.0,364,57,8,1,Allow empty replacement with ReplacePathRegex middleware
e95fde565295fe3220197e1fe43ffc0ddded5e8c,False,1,1,1,1,1.0,0,60,60,0.03225806451612903,1.0,1.0,862,142,39,1,"Fix preflight response status in access logs

Co-authored-by: lbenguigui <lbenguigui@gmail.com>"
c441d04788c8262ec53ab38dc2a1519a71032761,False,1,5,90,38,18.0,88,156,68,0.2727272727272727,0.9454545454545454,0.9454545454545454,19618,2700,567,7,"Avoid updating Accepted status for routes matching no Gateways

Co-authored-by: Kevin Pollet <pollet.kevin@gmail.com>"
a42d396ed212481f645b6b9cfc9c6591353dac85,False,1,2,40,36,20.0,30,30,0,0.0,0.0,0.0,1634,246,52,6,"Clean connection headers for forward auth request only

Co-authored-by: Kevin Pollet <pollet.kevin@gmail.com>"
e62f8af23b2613ee7f559528d2862de3e079a546,False,1,2,4,2,2.0,2,2,0,,,,2594,420,94,2,Rework condition to not log on timeout
61bb3ab9912a0a7c8b59e50c90e49a84b37ef827,False,1,1,2,2,2.0,1,1,0,,,,1801,294,66,1,Rework condition to not log on timeout
2096fd70815050374f4320655b7c89ff68e246d8,False,1,2,25,23,12.5,65,31,-34,0.19230769230769232,0.0,0.0,1456,241,57,3,"Drop untrusted X-Forwarded-Prefix header

Co-authored-by: Kevin Pollet <pollet.kevin@gmail.com>"
ad613e58cdc9cc381fc354063a0b9792cf20646e,False,1,2,2,1,1.0,1,30,29,0.0,0.8333333333333334,0.8333333333333334,4830,709,179,1,Allow configuring rule syntax with Kubernetes Ingress annotation
d1bdeb3a92ba539021dbc5c33939587239e53639,False,1,1,62,62,62.0,27,35,8,1.0,1.0,1.0,1461,242,46,4,"Fix missing trailer with custom errors middleware

Co-authored-by: LandryBe <lbenguigui@gmail.com>"
8a0c1e614fad3b9735814002f26fcb04c2314a06,False,1,2,290,284,145.0,134,239,105,0.16666666666666666,0.8541666666666666,0.9166666666666666,6077,913,230,9,"Fix HostRegexp config for rule syntax v2

Co-authored-by: Romain <rtribotte@users.noreply.github.com>"
f70949e3fa1e10e39bd06ba80ccb99f2eb6c2b00,False,1,2,6,3,3.0,3,40,37,1.0,1.0,1.0,2258,372,82,2,Fix case problem for websocket upgrade
cc80568d9e60d04b97318c9b36e909d6355dc11d,False,1,3,55,25,18.333333333333332,27,80,53,0.24390243902439024,0.7804878048780488,1.0,3300,511,110,7,Fix internal handlers ServiceBuilder composition
1c80f12bc289a99d0f4118103f0cabbd946baa00,False,1,1,10,10,10.0,5,57,52,0.16666666666666666,1.0,0.9166666666666666,3547,558,121,1,Apply keepalive config to h2c entrypoints
7edb9a2101416f8d48492a7447ff3f693d459f4e,False,1,1,16,16,16.0,214,331,117,0.0,0.0,1.0,5047,740,178,2,Bump github.com/go-acme/lego to v4.19.2
27948493aa047a5fdc2eb59c438ce3bc37cb756c,False,1,1,93,93,93.0,16,143,127,0.5054945054945055,1.0,1.0,633,103,22,11,Panic on aborted requests to properly close the connection
e3ed52ba7caa723bc34a7618652c2b7c5c4bcfef,False,1,5,672,341,134.4,278,424,146,0.3375,0.55,1.0,5772,947,211,35,"Detect and drop broken conns in the fastproxy pool

Co-authored-by: Romain <rtribotte@users.noreply.github.com>"
f18fcf3688b850f5e89530bb1bccf002fd592473,False,1,2,29,27,14.5,10,366,356,0.030716723549488054,0.8771331058020477,0.9658703071672355,2798,398,70,2,Preserve GRPCRoute filters order
eeb99c35363f3b6b0c835a9244d15a95f7f197db,False,1,1,39,39,39.0,19,46,27,0.0,0.3181818181818182,0.3181818181818182,4260,596,128,1,Preserve HTTPRoute filters order
ef168b801c43080b373190967c27b48631a009ed,False,1,2,136,103,68.0,92,125,33,0.9655172413793104,1.0,0.0,2730,463,97,14,"Refactor compress handler to make it generic

Co-authored-by: Romain <rtribotte@users.noreply.github.com>"
e9d677f8cbdd86541dde8fb15608f9de978d7b74,False,1,3,61,27,20.333333333333332,17,47,30,0.0,1.0,0.9411764705882353,15578,2172,465,6,Support http and https appProtocol for Kubernetes Service
1508a2c221b7df4cd310b0da71b7a4244b8f0290,False,1,1,12,12,12.0,5,99,94,0.0,0.9,1.0,7804,1109,252,1,"Do not update gateway status when not selected by a gateway class

Co-authored-by: Romain <rtribotte@users.noreply.github.com>"
f16d14cfa6853dfaf98053a7eace39f0f460f8b7,False,1,1,20,20,20.0,34,45,11,1.0,1.0,1.0,1780,313,68,3,Reuse compression writers
4d6cb6af030688a9e341438020210b8d3cdb3012,False,1,1,13,13,13.0,4,9,5,0.5,0.5,1.0,5122,750,181,2,Ensure defaultGeneratedCert.main as Subject's CN
d339bfc8d226fc8d1c1c86ddf13c71e38f069a42,False,1,1,51,51,51.0,59,31,-28,1.0,1.0,0.0,424,82,22,4,Use correct default weight in Accept-Encoding
a762cce430cdcce0b07bc8a14bb792bcf572ea07,False,1,1,15,15,15.0,10,20,10,0.7777777777777778,0.7777777777777778,0.7777777777777778,1005,132,25,2,Close wasm middleware to prevent memory leak
c02b72ca51e6dc8e0a92868cb168159b3343589b,False,1,1,2,2,2.0,9,56,47,0.023255813953488372,1.0,1.0,4452,629,166,1,Disable IngressClass lookup when disableClusterScopeResources is enabled
15973f5503d07817ee9e0cf16f6b550c3be91a51,False,1,1,5,5,5.0,0,5,5,0.0,0.0,1.0,1904,302,67,1,Remove deadlines when handling PostgreSQL connections
14e5d4b4b36313cce6b38efcc3a6497e1e9dde3d,False,1,1,2,2,2.0,90,3,-87,0.0,0.0,0.0,25,7,0,0,Remove unused boot files from webui
707f84e2e4e70fca56207417d7d3d3bc252c1782,False,1,1,7,7,7.0,1,6,5,0.0,0.0,1.0,665,114,25,1,Don't log EOF or timeout errors while peeking first bytes in Postgres StartTLS hook
cef842245c032c063a463f2baaf7c92ecc5a8070,False,1,3,193,99,64.33333333333333,86,418,332,0.2857142857142857,0.6818181818181818,1.0,7201,1183,269,10,"Introduce Lingering Timeout

Co-authored-by: Baptiste Mayelle <baptiste.mayelle@traefik.io>
Co-authored-by: Kevin Pollet <pollet.kevin@gmail.com>"
f3eba8d3a24b3fcc07ebc5f9a4d8e43c61675ac0,False,1,1,62,62,62.0,15,63,48,0.0,0.5555555555555556,0.8611111111111112,875,139,20,7,Guess Datadog socket type when prefix is unix
ac42dd8f83d21601fd97393d5a5b11ebfcad3440,False,1,1,2,2,2.0,1,1,0,,,,512,86,12,1,Check if ACME certificate resolver is not nil
f90f9df1db95bccb6bf5f46f90f350134ce62f8d,False,1,1,41,41,41.0,20,167,147,0.016129032258064516,1.0,1.0,2022,316,69,2,Ensure proper logs for aborted streaming responses
2714831a4e6a0972a0eca5d46af2f82f9ed2efd9,False,1,1,3,3,3.0,3,4,1,1.0,1.0,1.0,1528,274,59,1,fix: otlp doc + potential panic
71d4b3b13c3a2d1792ccc26d3eb8e1854a451767,False,1,1,27,27,27.0,7,46,39,0.19444444444444445,0.75,1.0,2022,316,69,2,Make the keys of the `accessLog.fields.names` map case-insensitive
8c977b8f8cb43396c21bd38c96e01fc5c617907b,False,1,1,5,5,5.0,6,3,-3,,,,946,123,23,1,Removes goexport dependency and adds _initialize
0cf2032c1525cee2bb80ae3cf5a31e48a1f28999,False,1,5,80,35,16.0,24,142,118,0.08064516129032258,0.0,0.7903225806451613,8356,1329,261,6,Allow handling ACME challenges with custom routers
d547b943df3b9abcc9482a86ebfef395b23786c1,False,1,5,10,2,2.0,48,48,0,,,,11429,1750,405,5,Spelling
cf2869407dcc52e53e9540543ee3d25fb4a036bb,False,1,2,30,18,15.0,38,75,37,0.38461538461538464,0.8846153846153846,0.8846153846153846,3023,433,94,3,Wrap capture for services used by pieces of middleware
e7dc097901e62963d0239cd4db366376971ca110,False,1,1,10,10,10.0,3,7,4,1.0,1.0,1.0,486,97,22,2,Prevent error logging when TCP WRR pool is empty
58dcbb43f97644e62a3f4c4fcdb37b19e3c44ef7,False,1,5,266,240,53.2,109,164,55,1.0,1.0,1.0,18566,2541,573,12,"Retry on Gateway API resource status update

Co-authored-by: Kevin Pollet <pollet.kevin@gmail.com>"
8970ae91998ce3bb8d79059b24645e0cba2c5770,False,1,1,17,17,17.0,92,115,23,,,,2992,502,99,11,Update to github.com/docker/docker v27.1.1
bb6cd581a639588c245e33728a43456ea3788152,False,1,6,163,64,27.166666666666668,314,560,246,1.0,1.0,1.0,9435,1506,281,24,"Align OpenTelemetry tracing and metrics configurations

Co-authored-by: Michael <michael.matur@gmail.com>"
52e95deee3023ae051d4d57bffa4abe0ad3cbf52,False,1,1,2,2,2.0,133,12085,11952,0.0,0.0,1.0,946,154,32,3,"In cluster Gateway API Conformance Tests

Co-authored-by: Kevin Pollet <pollet.kevin@gmail.com>"
5380e48747f71424bffb7f90a176c3d771f57a4b,False,1,1,47,47,47.0,34,13,-21,1.0,1.0,0.0,4489,558,144,4,Include status addresses when comparing Gateway statuses
7dbd3f88f63935dd676a2bbfbbea1dc2c09bf98f,False,1,4,177,136,44.25,63,116,53,1.0,0.0,0.8837209302325582,14581,2001,455,20,Do not update route status when nothing changed
898eab20ac8098e09b3bbc0409a3ff319f00de5b,False,1,1,7,7,7.0,56,74,18,,,,2922,375,91,3,Improve error and documentation on the needed link between router and service
a1270d6cc7e2d24f3d461c13d3e628285889b969,False,1,1,18,18,18.0,1,17,16,0.0,0.0,1.0,2250,332,84,1,"Use specified network for ""container"" network mode"
8cb18296983bd18b4f6cbae41ac04020cdc3a895,False,1,8,107,80,13.375,226,567,341,0.0,0.9959677419354839,0.9959677419354839,9238,1444,275,12,Upgrade to OpenTelemetry Semantic Conventions v1.26.0
f3479f532b42eb3f506294271b43085ef371e5d1,False,1,1,33,33,33.0,13,20,7,0.0,0.0,1.0,2963,476,96,1,Fix ECS config for OIDC + IRSA
a5df24a21d855a653dfa83ca449279683fcbbd6c,False,1,5,10,2,2.0,116,37,-79,,,,6626,1035,190,0,Upgrade dependencies
386c2ffb20094f69e733dd1cf8653283bf46b6ca,False,1,2,27,26,13.5,15,19,4,0.0,0.6666666666666666,0.3333333333333333,3529,506,109,4,Use ServiceName in traefik_service_server_up metric
f5a811d8fa654ad5b65c1689c2a22724f560cdb8,False,1,1,2,2,2.0,1,1,0,,,,402,84,14,1,Make the log about new version more accurate
900784a95a32d9723528d0a4250aa13f38ca0bef,False,1,1,6,6,6.0,25,140,115,0.3375,1.0,0.875,474,72,11,2,"Disable QUIC 0-RTT

Co-authored-by: Julien Salleyron <julien.salleyron@gmail.com>"
8946dd1898aa0b4d02cf1e4684629c151d8a1f6e,False,1,1,8,8,8.0,3,7,4,0.3333333333333333,1.0,1.0,433,77,19,1,Remove interface names from IPv6
2a0cfda90b28e27384a0a4368b7f2a67a47ec3aa,False,1,1,6,6,6.0,7,0,-7,1.0,1.0,0.0,1511,272,59,1,Do not disable Gateway API provider if not enabled in experimental
fe4cca6e9c66d3012b82d602c134c7accdf816c5,False,1,2,4,2,2.0,2,2,0,,,,362,56,12,0,Fix build only linux and darwin support wazergo
b452f37e0813a814f69d02a5383cfc15e666f0f4,False,1,4,107,40,26.75,211,628,417,0.11594202898550725,0.2318840579710145,1.0,14092,2304,498,4,Fix default value of Healthcheck for ExternalName services
bda4f50eae84f7079a887f82d8e580f4f408cdfb,False,1,1,12,12,12.0,6,6,0,,,,3195,476,104,1,Avoid cumulative send anonymous usage log
778dc22e14323abc6c547a7b0bdbb1b6260f3079,False,1,3,208,137,69.33333333333333,66,398,332,0.043689320388349516,0.6699029126213593,0.9466019417475728,2613,540,108,8,Support Accept-Encoding header weights with Compress middleware
e33bd6874f41d7943a16fa36802f8d2db74c99b5,False,1,1,2,2,2.0,1,1,0,,,,433,66,14,1,Append to log file if it exists
d65de8fe6c673ddb730d08f19f8bbbaee16078f3,False,1,2,15,8,7.5,15,60,45,0.25,0.5,1.0,6443,913,209,7,Fix rule syntax version for all internal routers
c2c1c3e09e2bcf41440eb823c01e70abe0548cb6,False,1,1,71,71,71.0,34,81,47,0.0,0.9361702127659575,1.0,1336,182,46,2,Fix the rule syntax mechanism for TCP
95312d5324a5256ef8ec21e0cae4e2d89f85faa5,False,1,2,6,4,3.0,0,18,18,0.0,0.0,1.0,7758,1135,246,1,Adds the missing circuit-breaker response code for CRD
7b649e2f0c3150faa55312da06f6d6986bfc441b,False,1,1,2,2,2.0,2,2,0,,,,941,142,28,1,Fix some typos in comments
099c7e9444a5d56918b8221672fc8d6a09a5d389,False,1,3,197,103,65.66666666666667,389,125,-264,0.7189542483660131,0.3202614379084967,0.0,6717,1099,242,10,"Revert LingeringTimeout and change default value for ReadTimeout

Co-authored-by: Romain <rtribotte@users.noreply.github.com>"
